{
  "$schema": "https://json-schema.org/draft/2020-12/schema",
  "$id": "ithina.dis.contracts.pubsub.identity.changed.v1",
  "title": "identity.changed",
  "description": "Published by the Identity Service when admin database writes change a tenant or store record. Consumed by the mirror-sync-consumer to update identity_mirror tables in the data-platform Postgres so canonical FKs stay valid.",
  "type": "object",
  "required": [
    "schema_version",
    "event_id",
    "event_type",
    "entity",
    "entity_id",
    "source_ts",
    "payload"
  ],
  "properties": {
    "schema_version": {
      "type": "integer",
      "const": 1
    },
    "event_id": {
      "type": "string",
      "format": "uuid",
      "description": "Unique identifier for this event. Used by the mirror-sync-consumer for idempotency."
    },
    "event_type": {
      "type": "string",
      "enum": ["created", "updated", "deactivated"],
      "description": "What kind of change occurred. Deactivation is soft-delete; no hard-delete event exists."
    },
    "entity": {
      "type": "string",
      "enum": ["tenant", "store"],
      "description": "Which entity type changed."
    },
    "entity_id": {
      "type": "string",
      "pattern": "^(t|s)_[a-z0-9]{12}$",
      "description": "The tenant_id (t_*) or store_id (s_*) of the affected row."
    },
    "tenant_id": {
      "type": "string",
      "pattern": "^t_[a-z0-9]{12}$",
      "description": "Owning tenant. For entity=tenant, same as entity_id. For entity=store, the parent tenant."
    },
    "source_ts": {
      "type": "string",
      "format": "date-time",
      "description": "Timestamp of the change in the admin database. Used as conflict-resolution key (older source_ts never overwrites newer)."
    },
    "payload": {
      "type": "object",
      "description": "The current state of the entity. Shape depends on entity type. The mirror-sync-consumer projects only the fields that identity_mirror tables care about.",
      "properties": {
        "name": { "type": "string" },
        "is_active": { "type": "boolean" },
        "metadata": {
          "type": "object",
          "description": "Free-form additional fields. Receiver-side resolve methods may use; mirror-sync-consumer ignores."
        }
      },
      "additionalProperties": true
    }
  },
  "additionalProperties": false
}
