{
  "schema_version": 1,
  "event_id": "b2c3d4e5-f6a7-4b8c-9d0e-1f2a3b4c5d6e",
  "event_type": "deactivated",
  "entity": "store",
  "entity_id": "s_acme0001a4b7",
  "tenant_id": "t_acme9k2l1mn4",
  "source_ts": "2026-05-27T16:08:00.000Z",
  "payload": {
    "name": "Acme Downtown #4",
    "is_active": false,
    "metadata": {
      "deactivated_reason": "store_closed",
      "previously_active_from": "2024-01-15T00:00:00.000Z"
    }
  }
}
